{
  "title": "Hanzo Chat",
  "description": "Hanzo Chat — AI chat platform",
  "icon": "MessageCircle",
  "defaultOpen": true,
  "pages": [
    "index",
    "features",
    "configuration",
    "models",
    "agents",
    "file-uploads",
    "plugins",
    "moderation",
    "self-hosting",
    "authentication",
    "environment"
  ]
}
