{
  "title": "Commerce",
  "description": "Hanzo Commerce — billing, payments, subscriptions",
  "icon": "ShoppingCart",
  "pages": [
    "index",
    "quickstart",
    "architecture",
    "modules",
    "storefront",
    "admin",
    "sdk",
    "guides",
    "api",
    "recipes",
    "deployment"
  ]
}
