{
  "title": "Integrations & Extensions",
  "description": "Install and connect Hanzo everywhere you work — one API key, one identity.",
  "icon": "Puzzle",
  "defaultOpen": false,
  "pages": [
    "browser",
    "ides",
    "desktop",
    "office",
    "design",
    "comms",
    "business",
    "dev",
    "productivity",
    "verticals"
  ]
}
