{
  "title": "Hanzo Dev",
  "description": "AI-powered coding assistant for your terminal",
  "icon": "Terminal",
  "defaultOpen": false,
  "pages": [
    "web",
    "getting-started",
    "usage",
    "configuration",
    "integrations",
    "architecture",
    "reference",
    "contributing",
    "faq"
  ]
}
