{
  "title": "SDKs",
  "description": "One generated client per language for the whole /v1 surface, plus the hand-written AI, per-service and identity libraries.",
  "icon": "Code",
  "pages": [
    "typescript",
    "python",
    "go",
    "rust",
    "swift",
    "kotlin",
    "java",
    "cpp",
    "iam",
    "---[AppWindow]Interface---",
    "app",
    "mod",
    "---[Database]Data collection---",
    "ast"
  ]
}
