{
  "title": "Hanzo Skills Reference",
  "description": "Comprehensive reference for all 126 Hanzo skills",
  "icon": "BookOpen",
  "pages": [
    "index",
    "---AI & Agents---",
    "ai-development-guide",
    "hanzo-aci",
    "hanzo-agent",
    "hanzo-bot",
    "hanzo-code",
    "hanzo-computer",
    "hanzo-dev",
    "hanzo-mcp",
    "hanzo-memory",
    "hanzo-operative",
    "hanzo-tools",
    "hanzo-vllm",
    "---Apps & Design---",
    "hanzo-app",
    "hanzo-brand",
    "hanzo-desktop",
    "hanzo-docs",
    "hanzo-editor",
    "hanzo-extension",
    "hanzo-flow",
    "hanzo-live",
    "hanzo-playground",
    "hanzo-search",
    "hanzo-store",
    "hanzo-studio",
    "hanzo-suite",
    "hanzo-ui",
    "hanzo-website",
    "---Blockchain & Web3---",
    "hanzo-contracts",
    "hanzo-evm",
    "hanzo-explorer",
    "hanzo-faucet",
    "hanzo-identity",
    "hanzo-mpc",
    "hanzo-nchain",
    "hanzo-network",
    "hanzo-node",
    "hanzo-web3",
    "hanzo-web3-gateway",
    "---Commerce & Finance---",
    "hanzo-authorizenet",
    "hanzo-checkout",
    "hanzo-commerce",
    "hanzo-commerce-api",
    "hanzo-billing",
    "hanzo-form",
    "hanzo-gochimp",
    "hanzo-ledger",
    "hanzo-numscript",
    "hanzo-payments",
    "hanzo-reconciliation",
    "hanzo-sign",
    "hanzo-treasury",
    "hanzo-registry",
    "---Identity & Security---",
    "hanzo-guard",
    "hanzo-iam",
    "hanzo-id",
    "hanzo-kms",
    "hanzo-vault",
    "---ML & Research---",
    "hanzo-ane",
    "hanzo-candle",
    "hanzo-engine",
    "hanzo-gym",
    "hanzo-jin",
    "hanzo-kensho",
    "hanzo-koe",
    "hanzo-ml",
    "hanzo-mugen",
    "hanzo-sho",
    "zenlm",
    "---Data & Messaging---",
    "hanzo-analytics",
    "hanzo-database",
    "hanzo-datastore",
    "hanzo-documentdb",
    "hanzo-insights",
    "hanzo-kv",
    "hanzo-kv-go",
    "hanzo-logs",
    "hanzo-metrics",
    "hanzo-o11y",
    "hanzo-orm",
    "hanzo-pubsub",
    "hanzo-pubsub-go",
    "hanzo-s3",
    "hanzo-search-go",
    "hanzo-sentry",
    "hanzo-sql",
    "hanzo-storage",
    "hanzo-stream",
    "hanzo-vector",
    "hanzo-vector-go",
    "---Platform & Infrastructure---",
    "hanzo-charts",
    "hanzo-cli",
    "hanzo-dataroom",
    "hanzo-dns",
    "hanzo-edge",
    "hanzo-extract",
    "hanzo-functions",
    "hanzo-gateway",
    "hanzo-hke",
    "hanzo-ingress",
    "hanzo-log",
    "hanzo-operator",
    "hanzo-platform",
    "hanzo-relay",
    "hanzo-repl",
    "hanzo-skill",
    "hanzo-stack",
    "hanzo-terraform",
    "hanzo-tunnel",
    "hanzo-universe",
    "hanzo-vm",
    "hanzo-zap",
    "hanzo-zrok",
    "hanzo-zt",
    "---Products---",
    "hanzo-chat",
    "hanzo-cloud",
    "hanzo-console",
    "hanzo-ai-api",
    "---SDKs & Libraries---",
    "go-sdk",
    "hanzo-base",
    "hanzo-openapi",
    "hanzo-sdk",
    "hanzo-trpc-openapi",
    "js-sdk",
    "python-sdk",
    "rust-sdk",
    "---Research & Governance---",
    "hanzo-hips"
  ]
}
