{
  "title": "Hanzo KMS",
  "description": "Key Management Service",
  "defaultOpen": true,
  "pages": [
    "service-integration",
    "universal-auth",
    "kmssecret-crd",
    "getting-started",
    "platform",
    "integrations",
    "sdks",
    "cli",
    "guides",
    "internals",
    "self-hosting",
    "contributing",
    "setup"
  ]
}
