{
  "title": "Deployments",
  "description": "Deploy applications with Kubernetes, Docker, and Git",
  "icon": "Container",
  "root": true,
  "pages": [
    "---Orchestrators---",
    "index",
    "kubernetes",
    "docker-swarm",
    "docker-compose",
    "---Build & Deploy---",
    "git-deployments",
    "container-registry",
    "domains-tls"
  ]
}
